model,Description ,budget,type,Skills required
E-commerce store,An online retail platform for selling products or services..,low,online,"Web development, Product sourcing, inventory management, Marketing, and Branding
"
software as a Service (SaaS) Platform,Develop and offer a subscription-based software application accessible via the internet.,high,online,"Software development, User experience design, Cloud computing, Subscription 
"
Consulting Firm,Provide expert advice and solutions in a specific industry or field,low,online,"Industry expertise, Business acumen
Communication, negotiation skills, Consulting methodologies and 
Client relationship management"
Food Truck Business,Operate a mobile food service business selling a variety of foods from a truck or van.,low,online,"Culinary skills, Food safety regulations.
Mobile food service operations, Customer service, and Business management"
Digital Marketing Agency,"Offer digital marketing services such as SEO, social media marketing, and content creation to businesses.
Fitness Studio/Gym: Open a fitness studio or gym offering",low,online,"Marketing strategy, SEO optimization, Content creation, Social media management and Data analysis"
Mobile App Development Company,"Develop and market mobile applications for various platforms (iOS, Android).",high,Online,"Mobile app development, Programming languages, User interface design, Quality assurance/testing, Project management"
Content Creation Agency,"Create and deliver content (articles, videos, graphics) for businesses and brands.",low,online,"Content writing/editing, Graphic design, Video production/editing, Content strategy, Client management"
Property Management Company,Manage and oversee rental properties on behalf of property owners.,medium,online,"Real estate knowledge, Property maintenance, Tenant management, Financial management, Legal regulations"
Handmade Crafts Online Store,Sell handmade crafts and artisan products through an online store platform.,low,online,"Crafting skills, E-commerce platform management, Product photography, Inventory management,
Marketing and promotion"
Subscription Box Service,Curate and deliver subscription boxes containing themed products to subscribers.,low,online,"Product curation, Supply chain management platform management, Branding and packaging design, Customer service"
Social Media Management Agency,Manage and optimize social media accounts and campaigns for businesses.,low,online,"Social media marketing, Content creation,
Analytics and data interpretation, Client management, Campaign strategy, and execution"
Event Planning and Management Company,"Plan and execute events such as weddings, conferences, and parties for clients.",low,online,"Event coordination, Project management,
Vendor negotiation, Budgeting, and finance management, Marketing, and promotion"
Fitness Studio/Gym:,"Open a fitness studio or gym offering classes, personal training, and fitness programs.",low,Online ,"Personal training certification, Fitness programming, Gym operations management, Customer service, Sales and marketing"
Online Course Platform,Create and sell online courses on various subjects and topics.,low,online,"Course development and instructional designees-learning technology, Content creation ,Marketing and sales, Customer support and community management"
Graphic Design Studio,"Provide graphic design services for branding, marketing, and advertising purposes.",low,online,"Graphic design software proficiency, Creative thinking, and design skills,
Client communication and collaboration,
Branding and identity design, Print and digital design expertise"
Personal Training Services,Offer personalized fitness training and coaching to individuals.,low,online,"Personal training certification, Fitness programming, Nutrition knowledge, Client communication and motivation, Business and marketing skills"
Travel Agency,"Plan and book travel arrangements for clients, including flights, accommodations, and activities.",low,online,"Destination knowledge, Travel planning and booking, Customer service, Vendor relationship management, Sales and marketing"
Real Estate Investment Company,Invest in and manage real estate properties for rental income or capital appreciation.,high,online,"Property management, Legal and regulatory knowledge, Real estate market analysis, Investment strategy development"
Language Learning App Development,Develop and market mobile apps for language learning and education.,medium,online,"Continuous integration, Continuous, Deployment (CI/CD), Content Management, Localization,  Backend Development"
Software Training and Education Center,Offer training courses and workshops on software applications and technologies.,low,online,"Subject matter expertise in software or technology instructional design and curriculum development, Teaching and training skills, Classroom management, Marketing, and sales"
Drone Photography and Videography platform,Offer aerial photography and videography services using drones. As a platform,low,online,"Drone piloting skills and certification,
Photography and videography techniques,
Editing and post-production software, proficiency, Safety, and regulatory compliance, Client communication, and project management"
Web Hosting and Domain Registration,Provide web hosting services and domain name registration for websites.,high,online,"Web hosting infrastructure management,
Domain registration and DNS management
, Technical support and troubleshooting,
Security and data protection, Customer service"
Virtual Event Planning Services,"Plan and coordinate virtual events such as webinars, conferences, and online workshops.",low,online,"Event planning and coordination, Technology and virtual platform expertise, Attendee engagement strategies, Vendor management, Project management"
AR-powered Virtual Try-On Platform,"Focus on a specific niche (e.g., makeup, eyewear, jewelry).  Leverage Augmented Reality (AR) technology to allow users to virtually try on products before purchasing. Integrate with e-commerce stores for seamless product purchase.",Low,Online,"AR Fundamentals, 3D Modeling (basic), Business Strategy, Market Research, Marketing & Sales, Data Security (optional)"
Interactive Skill-Sharing Community Platform,"This website fosters a community for people to share and learn skills. Hosts can create interactive workshops (live or recorded) on various topics (cooking, coding, crafts).  Participants can interact with hosts, ask questions, and receive personalized feedback.",Low,Online,"Web development skills to build and manage the website, community management skills to foster engagement and user interaction, and marketing skills to promote the platform and attract both hosts and participants."
AI-powered Personalized Learning Marketplace,"This platform connects learners with personalized learning experiences. An AI analyzes user strengths, weaknesses, and learning styles, recommending courses, tutors, and educational resources.",Low,Online,"Programming, AI Development, Education background"
Car Rental Services platform,Rent out cars to individuals and businesses for short-term use. In a platform ,low,online,"Fleet management,  Vehicle maintenance and servicing,  Rental agreements and contracts, Customer service and support,
Marketing and sales"
Social Impact Consulting,Provide consulting services to businesses and organizations focused on social and environmental impact.,low,online,"Understanding of social issues and impact areas, Research and analysis skills, Strategy development and implementation, Stakeholder engagement and relationship management, Project management and evaluation"
Niche Blogging Platform,Create and manage a blog focused on a specific niche or topic.,low,Online and physical,"Writing and content creation,  SEO optimization, Social media marketing,
Audience engagement and community building, Website management and analytics"
Food Delivery Service platform,Deliver food from local restaurants and eateries to customers' homes or offices. Platform,medium,online,"Food handling and safety regulations, Delivery logistics and route planning, Customer service, Inventory management, Marketing and promotion"
Renewable Energy Solutions Provider,Install and maintain renewable energy systems such as solar panels and wind turbines.,high,physical,"Renewable energy technologies, Energy efficiency principles, Project development and implementation, Permitting and regulatory compliance, Client education and consultation"
Home Cleaning Services platform,Provide residential cleaning services for homes and apartments. A platform that offers the above services.,medium,online,"Cleaning techniques and best practices, Time management and organization, Customer service, Supply management, Business administration"
Vintage Clothing Boutique,Open a boutique specializing in vintage and retro clothing and accessories.,medium,online,"Knowledge of vintage fashion trends and eras, Merchandising and visual display, Customer service, Inventory management, Marketing and branding"
Financial Advisory Services,"Offer financial planning, investment advice, and wealth management services.",low,online,"Financial planning and analysis, Investment knowledge, Retirement planning, Tax planning and preparation, Client relationship management"
Custom Apparel Printing Business,"Print custom designs and logos on apparel such as t-shirts, hoodies, and hats.",low,online,"Screen printing or digital printing techniques, Graphic design skills,
Knowledge of textile materials and inks, Inventory management, Sales and customer service"
Coworking Space Management,"Manage and operate shared office spaces for freelancers, entrepreneurs, and remote workers.",low,online,"Real estate management, Facility operations, and maintenance,
Community building and networking"
Online Marketplace for Handmade Goods,Create a platform for artisans to sell their handmade products online.,low,online,"E-commerce platform management, Product curation and selection, Marketing and promotion, Customer service, inventory management"
Podcast Production and Hosting,Produce and host podcasts on various topics and themes.,medium,online,"Audio editing and production skills,  Content planning and scripting, interviewing and hosting techniques, Podcast distribution platforms and tools, Marketing and promotion strategies"
Language Translation Services,Offer translation and interpretation services for individuals and businesses.,low,online,"Proficiency in multiple languages, Translation techniques, and practices, Cultural sensitivity and awareness, Terminology research, and reference tools
Client communication and project management"
Health and Wellness Coaching,Provide coaching and guidance to clients to improve their physical and mental well-being.,low,online,"Health and wellness knowledge, Coaching techniques and motivational skills, Goal setting and action planning, Client assessment and evaluation, Business development and marketing"
Interior Design Consultancy,Offer interior design services for residential and commercial spaces.,high,physical,"Interior design principles and aesthetics,
Space planning and layout design,
Knowledge of materials and finishes, Client consultation and communication, Project management"
Pet Grooming Services,"Provide grooming, bathing, and styling services for pets.",high,physical,"Pet grooming techniques and handling, Animal behavior understanding,
Sanitation and hygiene practices, Customer service and communication, Business management"
Specialty Coffee Shop,Open a cafe specializing in high-quality coffee and espresso drinks.,medium,physical,"Coffee brewing techniques, Menu development and ingredient sourcing, Customer service, Inventory management, Small business management"
Bookkeeping and Accounting Firm,"Offer bookkeeping, accounting, and financial management services to businesses.",low,online,"Accounting principles and standards
Proficiency in accounting software, Financial statement analysis, Tax preparation and compliance,
Client advisory and consultation"
Online Genealogy Research Service,Assist clients in researching their family history by digging through historical records and archives.,low,online,"Research skills, historical knowledge, access to genealogy databases"
Interactive Fiction with Choice-Driven Narratives,"Reimagine storytelling and put the reader in control.  This website offers interactive fiction, where users navigate choose-your-own-adventure style stories.
  The narrative branches based on user choices, leading to multiple endings and a truly personalized storytelling experience.  This website can be purely text-based, or incorporate multimedia elements like images and sound effects for an even richer experience.",Medium,Online,Creative Writing and Coding
Hyperlocal Community News and Events Platform,"Become the news hub for your neighborhood.  This website focuses on a specific town or city, providing hyperlocal news updates, event listings, community forums, and classifieds.  ",Medium,Online,"Web Development, Journalism, and  Local Area Knowledge"
Global Collaborative Music Composition Platform,"Break down geographical barriers and create music together.  This website fosters a global community of musicians where individuals can contribute musical segments (melodies, rhythms) to a continuously evolving composition.
  Users can vote on their favorite segments, influencing the direction of the piece and shaping a truly collaborative musical experience.",Medium,Online,"Web Development, Music Production, Community Management"
AI-powered Art Generator with User Input,"Unleash your inner artist and explore the possibilities of AI-generated art.  This website allows users to provide prompts (e.g., ""a starry night landscape in the style of Van Gogh"") and generate unique artwork using AI algorithms.  The website offers customization options like color palettes and brushstrokes, allowing users to refine the generated artwork.",Medium,Online,"Programming, AI Development, UI/UX Design"
Interactive Documentary Platform,"Step beyond static documentaries and create an immersive historical experience.  This website utilizes multimedia elements (videos, photos, audio interviews) alongside interactive features like maps, timelines, and quizzes. Users can explore historical events or social issues at their own pace, delve deeper into specific topics, and gain a richer understanding of the past.",Medium,Online,"Web Development, Video Editing, Storytelling, Historical Research"
Online Mindfulness Coach,Provide online coaching sessions to help individuals cultivate mindfulness and reduce stress.,low,online,"Mindfulness training,meditation techniques, coaching experience"
Virtual Assistant for Creative Professionals,"Provide administrative, scheduling, and project management support to busy creative professionals like writers or artists.",medium,online,"Excellent organization, time management, strong communication, familiarity with creative workflows "
AI-driven Cybersecurity Threat Detection and Prevention,"Analyzes network traffic and user behavior to identify and prevent cyber threats in real time.
Offers a crucial tool for businesses and organizations to enhance cybersecurity measures in the face of evolving threats.",Medium,Online,"Programming, AI, Cybersecurity expertise"
AI-powered Music Remixer and Style Transfer,"Takes an existing song and remixes it in a different genre or style using AI techniques.
Offers a creative tool for musicians and music producers, fostering unique remixes and artistic exploration.",Medium,Online,"Programming, Machine Learning, Music Production knowledge"
AI-powered Personalized Home Automation System with Predictive Needs ,"Learns user preferences and anticipates needs. Adjusts lighting, temperature, or home appliances based on user behavior and routines.
Offers a convenient and energy-efficient smart home experience.",Low,Online,"Programming, AI, Home Automation knowledge"
AI-driven Accessibility Assistant for Visually Impaired Users,"Assists visually impaired users by providing real-time object and scene recognition through audio descriptions or text overlays.
Improves accessibility and independent navigation for visually impaired individuals.",Low,Online,"Programming, Computer Vision, Assistive Technology knowledge"
AI-powered Personalized News Aggregator with Bias Detection,"Filters news articles based on user interests and provides summaries. Identifies potential biases in news content and offers diverse perspectives to promote informed decision-making.
Combats information overload and helps users stay informed with a more balanced perspective.",Low,Online,"Programming, NLP, Data Analysis)"
AI-assisted Mental Health Therapist Companion,"Provides additional support between therapy sessions. Uses AI to analyze user entries and conversational patterns to suggest coping mechanisms, journaling prompts, and mindfulness exercises. Important Note: This software should not replace professional therapy but serve as a complementary tool.",Low,Online,"Programming, NLP, Psychology background with Ethical AI considerations"
AI-powered Fashion Stylist with Outfit Recommendation and Trend Prediction,"Analyzes user's physical attributes, clothing preferences, and existing wardrobe to recommend personalized outfits.
Leverages AI to predict upcoming fashion trends and allows users to stay ahead of the curve.",Low,online,"Programming, Computer Vision, Fashion Design background"
AI-driven Personalized Travel Itinerary Planner,"Analyzes user preferences (interests, travel style, budget) and external data (weather, events, travel restrictions) to curate personalized travel itineraries.
Offers a unique and efficient way to plan customized travel experiences.",Low,Online,"Programming, NLP, Travel & Tourism knowledge"
AI-powered Worldbuilding Assistant for Creative Professionals,"ssists writers, game developers, or filmmakers by generating detailed world-building elements. Create realistic cultures, languages, histories, and geographies with AI.
Offers a powerful tool for creative brainstorming and fleshing out fictional worlds.",Medium,Online,"Programming, NLP, Storytelling"
AI-powered Language Tutor with Personalized Learning Paths,"Creates personalized language learning paths based on user proficiency and goals.
Adapts learning materials and exercises for a more efficient language learning experience.",Low,Online,"Programming, NLP, Linguistics background"
AI-driven Job Interview Simulator with Behavioral Analysis,"Simulates job interviews using AI to analyze user responses, identify areas for improvement, and provide personalized interview coaching.
Increases interview confidence and helps candidates land dream jobs.",Medium,Online,"Programming, NLP, Psychology background"
AI-powered Image Colorizer and Restorer,"Colorizes black and white photos or restores faded images using AI techniques.
Preserves historical memories and enhances visual content.",Low,Online,"Programming, Computer Vision, Image Processing"
AI-assisted Fitness Coach with Form Analysis and Workout Feedback,"Analyzes exercise form through video input and provides feedback for proper technique and injury prevention.
Offers personalized remote coaching and improves workout effectiveness.",medium,Online,"Programming, Computer Vision, Exercise Science"
AI-powered Personalized Music Composer,"Creates original music pieces based on user preferences (genre, mood, instruments).
Offers a unique tool for music creators and fosters personalized music experiences.",low,Online,"Programming, Machine Learning (ML), Music Theory"
AI-driven Customer Service Chatbot with Emotional Intelligence,"provides customer service support through a chatbot that understands user intent, emotions, and can adapt its responses accordingly.
Improves customer satisfaction and reduces wait times.",medium,Online,"Programming, NLP, Conversational Design"
AI-powered Code Reviewer and Style Enforcer,"Analyzes code for potential errors, suggests improvements, and enforces consistent coding style guidelines.
Improves code quality and developer efficiency.",Low,Online,"Programming, NLP, Software Engineering knowledge"
AI-assisted Content Summarizer and Topic Analyzer,"Extracts key points and summarizes long-form content (articles, research papers) with topic identification.
Improves information access and saves time for busy readers.",Low,Online,"Programming, Natural Language Processing (NLP)"
AI-powered Sleep Optimization Tool,"Analyzes sleep patterns (through wearables or sleep trackers) and suggests personalized sleep schedules, relaxation techniques, and environmental adjustments for improved sleep quality.",Medium,Online,"Programming, Data Analysis, Sleep Science background"
AI-driven Recipe Recommender with Leftover Utilization,"Recommends recipes based on user preferences, dietary restrictions, and available ingredients (including leftovers).
Minimizes food waste and promotes creative recipe inspiration.",Low,Online,"Programming, Data Analysis, Cooking knowledge"
AI-powered Personalized Learning Assistant,"Analyzes student learning styles, strengths, and weaknesses to generate personalized study plans and practice problems.",Medium,Online,"Programming, Education background, Data Analysis"
AI-powered Mental Health Companion App,"This app provides a safe space for users to track their mood, identify triggers, and practice relaxation techniques. It leverages AI to offer personalized recommendations for mindfulness exercises, journaling prompts, or self-care activities.",Medium,Online,"Programming skills (languages like Python or Java), understanding of psychology and mental health concepts, UI/UX design skills to create a calming and user-friendly interface."
Local Artisans Marketplace App,"This app connects local artisans with potential customers. Users can browse unique handcrafted items, filter by location and category, and directly purchase from artisans.",low,online,"Programming skills (consider existing e-commerce platforms for basic functionality), marketing skills to promote the app and artisans, and community management skills to build a network of local artisans and foster user engagement."
AR-powered Interactive Learning App,"This app utilizes augmented reality (AR) to create interactive learning experiences. Users can scan objects or locations to unlock educational content, 3D models, or historical information.",Low,Online,"Programming skills (languages like Unity or ARKit), knowledge of AR development tools and frameworks, 3D design skills"
Real-time Crowd-Sourced Event Planning App,"This app allows users to collaborate on planning events in real-time. Create events, suggest locations and activities, vote on options, and delegate tasks. Perfect for group outings, parties, or travel planning with friends.",Low,Online,"Programming skills (consider low-code platforms for basic functionality), project management skills to oversee app development, marketing skills to acquire users (social media, influencer marketing)."
AI-powered Habit Builder App,"This app uses AI to personalize habit-building programs. It analyzes user behavior, sets achievable goals, provides motivational prompts, and tracks progress with gamified elements.",Medium,Online,"Programming skills (languages like Python, Java, Swift, Kotlin) for app development, knowledge of AI concepts and machine learning libraries, UI/UX design skills to create a user-friendly and engaging interface."
Freelance Houseplant Sitter,"Offer plant-sitting services for people going on vacation or business trips. Water plants, provide sunlight, and ensure their overall well-being. Consider offering additional services like repotting or pest control for a premium.",Low,Physical,"Knowledge of basic houseplant care, reliability, and responsibility."
Online Language Exchange Partner,Offer conversation practice sessions for people learning your native language. Cater to students or professionals seeking conversational fluency. Utilize online platforms to connect with learners.,Low,Online,"Excellent communication skills in your native language, ability to converse engagingly on various topics."
Personalized Gift Basket Curator,"Create and sell curated gift baskets for various occasions (birthdays, holidays, graduations) based on recipient interests. Partner with local artisans or small businesses to source unique items.",low,Online,"Creativity in curating themes and selecting products, excellent customer service and communication skills."
Social Media Mystery Auditor,"Offer anonymous social media audits for businesses. Analyze their profiles for engagement, content quality, and brand alignment. Provide actionable recommendations for improvement.",low,online,understanding of social media best practices and audience engagement strategies.
Digital Declutter Consultant,"Help individuals declutter their digital lives. Organize photos, files, emails, and online accounts. Offer basic data backup and storage recommendations.",Low,Online,"Excellent organizational skills, and familiarity with various cloud storage solutions and digital organization tools."
Virtual Assistant for Busy Professionals,"Offer virtual assistant services focused on simple tasks for busy professionals. Manage calendars, schedule appointments, handle basic email communication, or organize travel itineraries.",Low,Online,"Strong organizational skills, excellent communication, and time management abilities."
Personalized Recipe E-cookbooks,"Compile and sell downloadable e-cookbooks featuring personalized recipes based on dietary restrictions or preferences (vegetarian, gluten-free, family-friendly).",Low,Online,"Strong culinary skills and recipe development experience, basic e-book creation knowledge (consider free e-book creation tools)."
