model,Description ,budget,type,Skills required
Social Media Scheduler for Small Businesses,"Offer basic social media scheduling services for small businesses. Focus on creating pre-designed templates (posts, stories) for common announcements (sales, events, new products) across various platforms.",Low,Online,"Understanding of basic social media scheduling tools, and ability to create visually appealing templates."
Hand-Lettered Quote Prints,"Create and sell digital prints featuring hand-lettered quotes or inspirational messages. Offer customization options (background colors, fonts) and cater to a market seeking personalized décor.",Low,Online,"Excellent hand-lettering skills or calligraphy experience, basic design software knowledge for creating printables."
Printable Party Decoration Store,"Design and sell downloadable templates for printable party decorations (banners, cupcake toppers, centerpieces). Offer various themes (birthdays, holidays, baby showers) and cater to DIY enthusiasts.",Low,Online,"Basic graphic design skills (using design software like Canva), creativity in designing party decorations, and marketing skills to reach party planning audiences."
Curated online Meditation Courses,"Partner with meditation instructors to create and sell online courses focused on specific meditation techniques (mindfulness, guided meditations, sleep meditation). Offer a subscription model with access to a library of courses and guided meditations.",Low,Online,"Understanding of meditation practices and their benefits, strong communication and marketing skills, and video editing skills (optional) for creating meditation course content."
Local History Walking Tour App,"Develop a smartphone app featuring self-guided walking tours highlighting the local history of your city or region. Offer different themed tours (architectural, historical events, ghost stories) with GPS navigation and audio narration. Monetize through a subscription model with access to all tours.",Medium,Online,"Research skills on local history, storytelling ability, basic app development knowledge (consider low-code app builders), and familiarity with GPS technology."
Online Community for Niche Hobbies,"Create a subscription-based online community catering to a specific niche hobby (bonsai trees, lock picking, mechanical keyboards). Offer exclusive content, forums, live chats, and member discounts with local vendors.",Low,Online,"Deep passion for the chosen niche, strong community management skills, basic website development, or platform management skills."
AI-powered Personalized Workout Creator,"Develop a web app that uses AI to generate personalized workout plans based on user goals, fitness levels, and equipment availability. Monetize through subscriptions, offering different workout plan tiers and customization options.",Low,Online,"Basic understanding of fitness principles and exercise science, knowledge of AI development tools (consider low-code platforms), and marketing and sales skills."
Microtask Matchmaker,"Connect freelancers with microtask platforms (short tasks like data entry, and transcription) based on skills and preferences. Charge a one-time fee or subscription for access to curated task listings and platform reviews.",Low,Online,"Familiarity with various microtask platforms, understanding of in-demand skills for microtasks, and strong communication and marketing skills."
"Cloud Gaming and Subscription Services (Skills: Tech knowledge, content creation",Promote cloud gaming services like Google Stadia or subscription platforms like Xbox Game Pass that offer access to a library of games for a monthly fee. Target gamers who prefer a flexible and cost-effective way to play.,Low,Online,"Understanding of cloud gaming technology and its benefits, ability to create informative content (comparisons, reviews) that highlights the value proposition of cloud gaming services, potentially technical skills for testing and reviewing cloud gaming performance."
"Educational Gaming and Gamified Learning Platforms (Skills: Education knowledge, content creation; Budget","Promote educational games and gamified learning platforms designed to make learning fun and engaging. Target parents, educators, and students seeking alternative learning methods.",Medium,online,"Knowledge of educational trends and the value of gamified learning, ability to create informative content (reviews, comparisons) that highlights the educational benefits of these platforms, potentially skills in educational content creation or teaching experience."
"Virtual Reality (VR) Hardware and Experience Platforms (Skills: Tech knowledge, content creation","Promote VR hardware like headsets and accessories alongside VR experience platforms offering games, social spaces, or fitness applications. Target early adopters and enthusiasts of VR technology",High,Online,"Understanding of VR technology and its capabilities, ability to create engaging content (reviews, tutorials) that showcases the benefits of VR, potentially technical skills for setting up and demonstrating VR equipment."
Online Graphic Design for Social Media,"Create eye-catching social media graphics (posts, stories, ads) for businesses and individuals.",low,online,"Graphic design software proficiency (Canva, Adobe Creative Suite), understanding of social media trends."
Online Grant Writer,Assist non-profit organizations and educational institutions with grant proposals to secure funding.,low,online,"Grant writing experience, research skills, strong writing, editing abilities"
Niche Game Genre Affiliate Programs,"Partner with affiliate programs focused on specific game genres you're passionate about. Promote indie horror games, strategy wargames, or niche simulation titles to a dedicated audience.",low,online,"Deep knowledge of the chosen genre, ability to create engaging content (reviews, guides, streams) that resonates with your audience, and strong community engagement skills to build trust and encourage clicks on your affiliate links."
Freelance Writer for Crypto Projects,"Offer freelance writing services for crypto projects, creating whitepapers, blog posts, website content, or social media copywriting. Target blockchain startups or established crypto companies.",Medium,Online,"Strong writing and editing skills, understanding of blockchain technology and crypto concepts."
NFT Art Curator for Niche Communities,"Research and discover talented NFT artists within specific niche communities (e.g., female artists, environmental art). Showcase their work on your platform or social media channels. Monetize through commissions from artists you promote, or offer premium services like NFT collection management for a fee.",Low,Online,"Eye for good art and understanding of NFT trends, ability to build relationships with artists and promote their work."
Social Media Influencer for Crypto Education,"Create educational content (videos, social media posts) on various crypto topics like DeFi, NFTs, or blockchain technology. Target a beginner audience and focus on simplifying complex concepts. Monetize through brand sponsorships, affiliate marketing, or promoting your own crypto courses.",Low,Online,"Strong understanding of core crypto concepts, excellent communication and teaching skills, ability to create engaging social media content."
Play-to-Earn (P2E) Game Tester and Reviewer,"Play various P2E games, assess their gameplay mechanics, earning potential, and user experience. Write reviews and tutorials for crypto gaming platforms or your own blog/channel. Monetize through ad revenue, affiliate marketing with P2E games, or sponsored reviews.",Low,Online,"Gaming experience, ability to write clear and engaging reviews, understanding of P2E game mechanics."
Social Media Management for Local Businesses,"Manage social media accounts for local businesses, creating content, engaging with followers, and running targeted ads.",low,online,"Social media marketing knowledge, understanding of local business needs, excellent communication and writing"
Microlearning Content Creator,"Develop bite-sized educational content (text, video, audio) on specific topics for online learning platforms or individual sale.",Low,online,"Subject matter expertise, clear and concise communication, video editing "
Virtual Coworking Space,"Create a virtual space where remote workers can connect, collaborate, and network through online tools and events. affiliate marketing with crypto exchanges or wallets.",low,online,"Community management, online event planning,strong communication."
Crypto News Aggregator with Earning Potential,Curate and summarize the latest news from reputable crypto sources into a daily or weekly newsletter. Offer free and premium tiers with additional features (Monetize through subscriptions and potential ,Low,Online,"Strong understanding of the crypto landscape, excellent writing and research skills, and basic email marketing knowledge."
Online Local Business Review Writer,Offer local businesses honest and detailed online reviews on platforms like Google My Business or Yelp. Highlight the business's strengths and unique offerings in exchange for a fee or potential client referrals.,Low,Online,"Excellent writing and communication skills, ability to provide constructive feedback, and knowledge of local businesses in your area."
Online Personalized Podcast Intro and Outro Creator,"Create custom intro and outro audio clips for podcasts, incorporating the podcast name, host information, and background music.",Low,Online,"Basic audio editing skills, ability to create short, engaging audio clips, and understanding of podcast production elements."
Online Handwritten Recipe Creator:,Develop and write out handwritten recipes in a visually appealing format. Sell them as downloadable PDFs or printed recipe cards through your website or online marketplaces like Etsy.,Low,Online,"Strong culinary skills and recipe development experience, excellent handwriting or calligraphy skills, basic photography skills (optional) for recipe card visuals."
Online Social Media Scheduler for Small Businesses:,"Offer social media scheduling services for small businesses. Create content calendars, schedule posts, and manage basic community ",Low,Online,"Strong understanding of social media algorithms and best practices, basic scheduling and content planning skills, "
Online Charity Auction Curator,"Partner with small charities and non-profit organizations to curate online auctions featuring unique experiences, donated items, or celebrity encounters. Manage the auction platform and facilitate bidding.",Low,Online,"Excellent communication and organizational skills, ability to build relationships with charities, basic understanding of online auction platforms."
Online Personalized Printable Art Shop,"Create digital art prints with customizable elements like names, quotes, or locations. Sell downloadable files that customers can print themselves.",Low,Online,"Basic graphic design skills (using design software like Canva), understanding of printable art trends, marketing skills to reach potential customers."
Online Stock Photo Editor and Reseller,"Purchase stock photos with commercial licenses, edit them for specific themes or aesthetics, and resell them on stock photo marketplaces.",Low,Online,"Basic photo editing skills (cropping, color correction), understanding of trending visual styles, knowledge of stock photo marketplaces."
Online ASMR Content Creator,"Create calming and relaxing ASMR (Autonomous Sensory Meridian Response) content featuring whispering, tapping, or crinkling sounds. Monetize through subscriptions, ",Low,Online,"Ability to create relaxing sounds using everyday objects, basic video editing and audio recording skillseating skills."
Online Handwritten Note Service,"Offer a personalized service where you write handwritten notes, letters, or cards on behalf of clients for birthdays, holidays, or special occasions.",low,online,"Excellent penmanship, calligraphy skills (optional), strong communication with clients for personalization."
Online Gamified Language Learning App,"Develop a language learning app that uses gamification elements (points, badges, leaderboards) to make learning engaging and interactive. Consider outsourcing development if lacking coding skills.",Medium,Online,"Understanding of language learning methodologies, knowledge of gamification principles, project management and marketing skills for promoting the app."
Online Mock Interview Service for Specific Industries,"Offer mock interview coaching sessions tailored to specific industries (tech, healthcare, finance). Leverage your own industry experience or collaborate with subject matter experts for different fields.",Low,Online,"Strong interview and communication skills, knowledge of specific industry interview formats and common challenges, coaching and feedback abilities"
Online Curated Learning Paths for Specific Skills,"Design and sell online ""learning paths"" that bundle existing online resources (articles, tutorials, courses) on specific skills like coding, data analysis, or social media marketing.",Low,Online,"Research and curation skills, understanding of different learning platforms and resources, marketing and sales skills."
Online Personalized Music Composition Service,"Compose personalized music pieces based on client preferences (mood, genre, occasion). Utilize music creation software or collaborate with freelance musicians if musically challenged.",Low,Online,"Basic music theory knowledge (helpful), understanding of different music genres, strong communication and customer service skills for tailoring compositions."
Online Micro-documentary Creator,"Produce short, high-quality documentaries (5-10 minutes) on captivating niche topics or untold stories. Monetize through subscriptions, sponsorships, or one-time purchases.",low,online,"Storytelling ability, research skills, basic video editing and production knowledge. (Can outsource editing if needed)"
Online Course on Building a Sustainable Wardrobe,"Develop an online course that teaches individuals how to build a more sustainable wardrobe through mindful shopping, upcycling clothes, and garment care techniques.",Low,Online,"Knowledge of sustainable fashion practices, understanding of fashion trends, strong instructional design and video creation skills"
Online Niche Translation Service,"Focus on translating documents and content for a specific niche industry (e.g., legal documents for the medical field, technical manuals for the renewable energy sector).",medium,online,"Fluency in two languages, deep understanding of the chosen niche industry terminology, translation and proofreading skills."
Online Personalized 3D-Printed Gift Service,"Partner with a 3D printing service and offer custom-designed 3D-printed gifts based on user preferences (photos, interests). Design the models yourself or collaborate with designers.",medium,online,"3D design software proficiency (optional, can outsource design), understanding of 3D printing limitations and capabilities, marketing and customer service skills."
AI-powered Personalized Sleep Coaching App,Develop an app that analyzes sleep patterns (through wearable integration or user input) and provides personalized coaching tips using AI to improve sleep quality.,Medium,Online,"Knowledge of sleep science and healthy sleep habits, collaboration with AI developers (or basic AI training), mobile app development skills (or outsourcing)."
Online Course on Building a Personal Brand for the Metaverse,"Develop an online course that teaches individuals how to build a strong personal brand within metaverse platforms, including avatar creation, online presence management, and community engagement.",medium,online,"Expertise in metaverse platforms and their functionalities, understanding of personal branding strategies, strong teaching and instructional design skills."
Online Biohacking Coaching and Community,Provide online coaching and a community forum for individuals interested in biohacking (optimizing health through lifestyle and technology). Offer personalized guidance and expert-led discussions.,medium,online,"Deep understanding of biohacking principles and practices, experience with health and wellness coaching, ability to build and manage online communities."
Online Legal Document Automation Service,"Develop a platform that allows users to generate basic legal documents (wills, contracts) with customizable templates and guidance, while advising them to consult an attorney for complex legal matters.",high,online,"Legal knowledge and understanding of common legal documents, web development skills,  collaboration with legal professionals."
Online Sustainability Consulting for Small Businesses,"Advise small businesses on implementing sustainable practices in their operations, reducing their environmental footprint, and communicating sustainability efforts to customers.",medium,online,"Sustainability best practices knowledge, understanding of small business challenges, communication and consulting skills."
Online Course on Emerging Technologies,"Develop and sell online courses on emerging technologies like blockchain, artificial intelligence, or the Internet of Things",high,online,"Expertise in the chosen technology, strong instructional design skills, video production and editing skills"
Online Community for Niche Hobbyists,Create a dedicated online community forum or subscription platform for enthusiasts of a specific niche hobby,low,online,"Deep knowledge of the chosen niche, strong community management skills, basic web development or forum management expertise."
Online Mindfulness Retreat Facilitator,"Design and host online mindfulness retreats, guiding participants through meditation exercises, yoga sessions, and interactive workshops via video conferencing platforms.",medium,online,"Mindfulness and meditation expertise, experience leading group sessions online, strong communication and facilitation skills."
Virtual Reality (VR) Fitness Experience Development,Develop immersive VR fitness experiences that gamify workouts and provide users with a unique fitness experience at home.,high,online,"VR development expertise (Unity, Unreal Engine), understanding of gamification principles, knowledge of exercise science"
Online Reputation Management for Esports Teams,"Provide online reputation management services for esports teams, monitoring social media mentions, managing fan communities, and mitigating negative publicity.",medium,online,"Strong understanding of esports culture and online communities, social media marketing expertise, and crisis communication skills."
Online Data Curation and Insights Service for Investors,"Aggregate and curate financial data from various sources, providing investors with actionable insights and analysis through online platforms or subscriptions.",medium,online,"Financial markets knowledge, data analysis skills, and strong communication skills for presenting insights."
Online Accessibility Consultant for the Metaverse,Consult with companies building metaverse experiences to ensure accessibility for users with disabilities.,medium,online,"Expertise in web accessibility standards (WCAG), understanding of emerging metaverse technologies, knowledge of user experience (UX) best practices."
Personalized AI Assistant for Content Creators,"Develop a niche AI assistant that helps content creators (writers, YouTubers, etc.) with brainstorming ideas, keyword research, and content optimization.",medium,online,"Machine learning and AI development, understanding of content creation workflows, and user experience (UX) design."
Online Resume and Cover Letter Writing Service,Assist individuals in crafting professional resumes and cover letters tailored to specific job applications.,medium,online,"Strong writing and editing skills, knowledge of resume best practices, and understanding of different job industries"
Online Business English Tutor,Provide online tutoring to non-native speakers who want to improve their English language skills for business purposes.,medium,online,"Excellent English language proficiency, strong understanding of business communication, and teaching experience."
Online Music Instructor,Offer online music lessons (instrumental or vocal) through video conferencing platforms.,medium,online,"Proficiency in the chosen instrument/vocals, online teaching experience, and ability to tailor lessons for different skill levels."
Online Language Tutor,Provide one-on-one or group language tutoring sessions via video conferencing platforms.,medium,online,"Fluency in the target language, strong teaching pedagogy, and online teaching platform familiarity."
Web designing agency,"Design and develop websites for businesses, organizations, and individuals.",low,online,"Web design principles and best practices
Proficiency in programming languages (e.g., HTML, CSS, JavaScript)
Knowledge of content management systems (e.g., WordPress, Drupal)
"
